{"metadata": {"ts_utc": "2025-10-07T16:55:58.896717", "role": "fundamental_filter", "model": "glm-4.6", "provider": "zhipuai", "base_url": "https://open.bigmodel.cn/api/paas/v4", "temperature": 1.0, "max_tokens": 60000, "seed": null, "cache_key": "2025-04-21_a2af9dd8997f2e38", "run_id": "ZHIPUAI_1", "retry_attempt": 0, "is_retry": false}, "input": {"system_prompt": "System: You are a professional-level quantitative analyst and portfolio strategist with over 15 years of experience in algorithmic trading and risk management. Your specialized role is to efficiently determine when fundamental analysis is necessary for stock trading decisions, optimizing the decision-making process by filtering out unnecessary fundamental noise while ensuring critical fundamental insights are captured.\n\nYour decision-making philosophy is efficiency-first and signal-focused. You understand that not every stock decision requires deep fundamental analysis - your expertise lies in identifying the specific market conditions, technical patterns, and risk scenarios where fundamental validation becomes critical for sound investment decisions.\n\nInput:\n- portfolio_info: Portfolio information\n  - total_assets: Total assets = available_cash + position_value\n  - available_cash: Cash available  \n  - position_value: Current market value of positions\n\n- symbols: Dictionary of stocks, each containing:  \n  - features: Structured feature data with the following sections:  \n    \n    [market_data]  \n    - ticker: Stock code (e.g., STOCK_A, STOCK_B)  \n    - open: Opening price  \n    - close_7d: Last 7 days closing prices [close_7, ..., close_0], close_0 is the most recent  \n    - date: Trading date (YYYY-MM-DD format)  \n    - price: Current price (when include_price=True)\n\n    [news_events]  \n    - top_k_events: News headlines/descriptions, type List[str]  \n\n    [position_state]  \n    - current_position_value: Current position value (amount)  \n    - holding_days: Number of days held  \n    - shares: Current shares held, cumulative total of all buy/sell actions  \n\n- history: Historical decision records  \n  - For each stock, list of past decisions containing:  \n    - date: Decision date, format \"YYYY-MM-DD\"  \n    - action: Past action \"increase|hold|decrease|close\"  \n    - cash_change: Cash change (positive for buy, negative for sell)  \n    - target_cash_amount: Target total position value  \n    - reasons: Decision reasons list  \n    - confidence: Decision confidence [0,1]\n\n<OUTPUT REQUIREMENTS>\n1. <ANALYSIS>: Professional assessment process\n   - Market Signals: Analyze price momentum, volatility patterns, and technical anomalies from market_data.close_7d\n     * Identify unusual price movements requiring fundamental validation\n     * Assess technical pattern strength and reliability\n     * Evaluate volume-price relationships and momentum sustainability\n   \n   - News Impact: Evaluate news_events.top_k_events for fundamental implications\n     * Corporate events (earnings, guidance, M&A, regulatory changes)\n     * Industry developments requiring fundamental context\n     * Market-moving news that technical analysis alone cannot assess\n   \n   - Position Risk: Assess position_state and portfolio concentration risks\n     * Large position exposure requiring fundamental risk validation\n     * Holding period considerations (position_state.holding_days)\n     * Portfolio diversification and concentration analysis\n   \n   - Historical Context: Review history for decision consistency and pattern recognition\n     * Previous fundamental-dependent decisions\n     * Strategy consistency requirements\n     * Risk management pattern analysis\n\n2. <FILTER_RESULT>: Strictly valid JSON output\n   - Output must be strictly valid JSON inside <FILTER_RESULT> tags, all strings use double quotes, correct syntax\n   - Must provide assessment for every stock in the input symbols; no omissions, no additions\n   - Must include specific data-driven reasoning based on available input features\n\nProfessional Criteria for Requiring Fundamental Analysis:\n- **Technical Anomalies**: Unusual volatility (>2σ from recent patterns), gap movements, or technical breakouts requiring fundamental validation\n- **News-Driven Events**: Earnings announcements, corporate actions, regulatory changes, or industry developments in news_events\n- **Position Risk Management**: Large positions (>portfolio allocation threshold) or extended holding periods requiring fundamental review  \n- **Valuation Inflection Points**: Stocks approaching historical price extremes where fundamental metrics become critical\n- **Strategy Consistency**: Historical decision patterns indicating fundamental dependency for this stock\n- **Portfolio Concentration**: Overweight positions requiring fundamental justification for continued exposure\n\nDefault Efficiency Principle: Default to NOT requiring fundamental data unless clear, specific criteria are met. Technical analysis and market data should be sufficient for routine trading decisions.\n\nFilter JSON Example:  \n<FILTER_RESULT>\n{\n  \"stocks_need_fundamental\": [\"AAPL\", \"MSFT\"],\n  \"reasoning\": {\n    \"AAPL\": \"Earnings announcement in news_events requires fundamental validation; unusual 15% volatility in close_7d pattern exceeds technical analysis reliability\",\n    \"MSFT\": \"Large position value (25% of portfolio) approaching 52-week highs requires fundamental risk assessment for continued exposure\",\n    \"GOOGL\": \"Technical pattern sufficient: stable close_7d trend, no significant news events, position size within normal allocation limits\",\n    \"TSLA\": \"Routine technical signals: normal volatility range, no material news catalysts, standard position management adequate\"\n  }\n}\n</FILTER_RESULT>\n", "user_prompt": "{\"portfolio_info\": {\"total_assets\": 89730.15, \"available_cash\": 12598.31, \"position_value\": 77131.83}, \"symbols\": {\"GS\": {\"features\": {\"market_data\": {\"ticker\": \"GS\", \"open\": 505.4, \"close_7d\": [516.87, 489.8, 494.44, 503.98, 507.89, 499.05, 509.49]}, \"news_events\": {\"top_k_events\": [\"Fidelity, Goldman Find Tariff Haven in Asian Consumer Stocks - (Bloomberg) -- The global trade war is providing a boon for Asian consumer stocks, as investors take shelter in companies that cater to local buyers’ essential needs. Most Read from BloombergDOGE Visits National Gallery of Art to Discuss Museum’s Legal StatusTrump Administration Takes Over New York Penn Station RevampDOGE Places Entire Staff of Federal Homelessness Agency on LeaveWhy the Best Bike Lanes Always Get BlamedNashville’s $3 Billion Transit Plan Brings a Call for Zoning ReformStrategis\", \"The Goldman Sachs Group (GS): Among Value Stocks in Ken Fisher’s Portfolio - We recently published a list of 10 Value Stocks in Ken Fisher’s Portfolio. In this article, we are going to take a look at where The Goldman Sachs Group, Inc. (NYSE:GS) stands against other value stocks in Ken Fisher’s portfolio. Trump’s “stupid” tariffs will fail; that’s the sentiment echoed by billionaire investor Ken Fisher as […]\", \"Our Top 10 High Growth Dividend Stocks - April 2025\", \"China Accelerates Budget Spending to Counter Tariff Woes - (Bloomberg) -- China expanded government spending at the fastest rate for any first quarter since 2022, ramping up support for an economy bracing for foreign demand declines as a trade war with the US intensifies.Most Read from BloombergDOGE Visits National Gallery of Art to Discuss Museum’s Legal StatusTrump Administration Takes Over New York Penn Station RevampDOGE Places Entire Staff of Federal Homelessness Agency on LeaveTrump Signs Executive Orders on Federal Purchasing, Office SpaceNashvil\"]}, \"position_state\": {\"current_position_value\": 4518.28, \"holding_days\": 35, \"shares\": 8.94}}}, \"MSFT\": {\"features\": {\"market_data\": {\"ticker\": \"MSFT\", \"open\": 362.81, \"close_7d\": [390.49, 381.35, 388.45, 387.81, 385.73, 371.61, 367.78]}, \"news_events\": {\"top_k_events\": [\"Jim Cramer Cautions on Microsoft Corporation (MSFT): “No Azure Acceleration, No Mercy—Watch That 380 Floor” - We recently published a list of Jim Cramer Defended American Superiority and Discussed These 13 Stocks. In this article, we are going to take a look at where Microsoft Corporation (NASDAQ:MSFT) stands against other stocks that Jim Cramer discussed. In his latest appearance on CNBC’s Squawk on the Street, Jim Cramer highlighted the often-overlooked role of […]\", \"This Is My Top Quantum Computing Stock for 2025, and It's Not IonQ or Rigetti Computing - IonQ and Rigetti Computing have surged 600% and 1,100%, respectively, since 2023 but could remain underdogs against this technology juggernaut.\", \"Is Microsoft Corporation (MSFT) the Best Metaverse Stock to Invest in? - We recently published a list of 12 Best Metaverse Stocks to Invest in. In this article, we are going to take a look at where Microsoft Corporation (NASDAQ:MSFT) stands against other best metaverse stocks to invest in. The metaverse, which comes under the video games industry, is a fast-growing digital frontier where immersive tech creates […]\", \"Billionaire fund manager makes bold bets on Meta, Nvidia stock - The veteran hedge fund manager's latest tech stock trades turn heads.\", \"GAM: Tech Exposure Could Mean Short-Term Pain\"]}, \"position_state\": {\"current_position_value\": 6069.89, \"holding_days\": 35, \"shares\": 16.73}}}, \"HD\": {\"features\": {\"market_data\": {\"ticker\": \"HD\", \"open\": 354.29, \"close_7d\": [355.39, 353.62, 353.86, 357.2, 354.11, 345.99, 355.06]}, \"news_events\": {\"top_k_events\": [\"Inside Home Depot’s $20 Billion Secret Garden - The retail giant spends years developing plants and flowers. The goal: make shoppers better gardeners—and loyal customers.\"]}, \"position_state\": {\"current_position_value\": 4549.08, \"holding_days\": 35, \"shares\": 12.84}}}, \"V\": {\"features\": {\"market_data\": {\"ticker\": \"V\", \"open\": 329.0, \"close_7d\": [332.43, 324.61, 333.4, 335.18, 335.81, 331.33, 329.61]}, \"news_events\": {\"top_k_events\": [\"2 Top Buffett Stocks to Buy and Hold for the Long Haul - Few investors manage to become a household name, but Warren Buffett is one of them.  Tons of investors look to Berkshire Hathaway's portfolio and investing moves to get an idea of moves they should make.  If you're seeking out a couple of Buffett stocks to add to your portfolio, look no further than the following two.\", \"Invest In 6 Funds For A Potential $5,000 Monthly Income\"]}, \"position_state\": {\"current_position_value\": 3987.48, \"holding_days\": 35, \"shares\": 12.12}}}, \"SHW\": {\"features\": {\"market_data\": {\"ticker\": \"SHW\", \"open\": 331.87, \"close_7d\": [336.25, 329.91, 336.77, 341.02, 336.88, 331.28, 333.38]}, \"news_events\": {\"top_k_events\": [\"UnitedHealth, NVIDIA Corp. share losses lead Dow's nearly 1175-point drop - UnitedHealth, NVIDIA Corp. share losses lead Dow's nearly 1175-point drop\", \"Sherwin-Williams: Is This Best-In-Class Company Worth The Premium Right Now? - The Sherwin-Williams Company excels in profitability and dividends but is overvalued. Read more on my earnings preview and a look at SHW stock valuation.\"]}, \"position_state\": {\"current_position_value\": 2459.16, \"holding_days\": 35, \"shares\": 7.41}}}, \"CAT\": {\"features\": {\"market_data\": {\"ticker\": \"CAT\", \"open\": 289.33, \"close_7d\": [301.01, 289.16, 293.45, 298.12, 293.43, 290.14, 294.25]}, \"news_events\": {\"top_k_events\": [\"Caterpillar Inc. (CAT): Among the Dividend Stocks with Sustainable Payout Ratios - We recently published a list of the 10 Dividend Stocks with Sustainable Payout Ratios. In this article, we are going to take a look at where Caterpillar Inc. (NYSE:CAT) stands against other best dividend stocks with sustainable payout ratios. Dividend-paying stocks have remained popular among investors due to their strong historical performance. This sustained interest has […]\", \"What Moved Markets This Week\", \"3 Never-Sell Dividend Gems I Expect To Easily Beat The Market\"]}, \"position_state\": {\"current_position_value\": 2965.63, \"holding_days\": 35, \"shares\": 10.25}}}, \"MCD\": {\"features\": {\"market_data\": {\"ticker\": \"MCD\", \"open\": 311.0, \"close_7d\": [303.96, 306.78, 309.9, 316.07, 312.48, 309.1, 311.3]}, \"news_events\": {\"top_k_events\": [\"Estimating The Intrinsic Value Of McDonald's Corporation (NYSE:MCD) - Key Insights The projected fair value for McDonald's is US$337 based on 2 Stage Free Cash Flow to Equity With US$311...\", \"McDonald's: A Great Company To Hold Long Term, But Currently Too Overvalued\"]}, \"position_state\": {\"current_position_value\": 5632.21, \"holding_days\": 35, \"shares\": 18.11}}}, \"UNH\": {\"features\": {\"market_data\": {\"ticker\": \"UNH\", \"open\": 449.76, \"close_7d\": [578.5, 594.4, 599.47, 587.06, 583.59, 585.04, 454.11]}, \"news_events\": {\"top_k_events\": [\"One Of The Worst Days In The UnitedHealth History, But That Can Be An Opportunity\", \"UnitedHealth Group (UNH): One of the Best Long Term Stocks to Buy According to Billionaires - We recently published a list of the 10 Best Long Term Stocks to Buy According to Billionaires. In this article, we are going to take a look at where UnitedHealth Group Incorporated (NYSE:UNH) stands against other best long term stocks. Dividend-paying stocks have traditionally been seen as a solid foundation for investment portfolios, offering steady income […]\", \"UnitedHealth: Don't Let This Steep Selloff Go To Waste\", \"5 Dividend Growth Stocks I'm Buying As Defensive Sectors Become Sexy Again\", \"What Moved Markets This Week\"]}, \"position_state\": {\"current_position_value\": 4178.27, \"holding_days\": 35, \"shares\": 9.29}}}, \"AXP\": {\"features\": {\"market_data\": {\"ticker\": \"AXP\", \"open\": 248.85, \"close_7d\": [262.36, 246.89, 251.13, 255.38, 257.86, 252.92, 251.31]}, \"news_events\": {\"top_k_events\": [\"3 No-Brainer Warren Buffett Stocks to Buy Right Now - Here are three of Berkshire Hathaway's favorite stocks.\"]}, \"position_state\": {\"current_position_value\": 3414.22, \"holding_days\": 35, \"shares\": 13.72}}}, \"AMGN\": {\"features\": {\"market_data\": {\"ticker\": \"AMGN\", \"open\": 277.29, \"close_7d\": [291.09, 281.41, 285.98, 293.92, 295.3, 282.64, 277.29]}, \"news_events\": {\"top_k_events\": [\"Is Most-Watched Stock Amgen Inc. (AMGN) Worth Betting on Now? - Zacks.com users have recently been watching Amgen (AMGN) quite a bit. Thus, it is worth knowing the facts that could determine the stock's prospects.\"]}, \"position_state\": {\"current_position_value\": 4450.5, \"holding_days\": 35, \"shares\": 16.05}}}, \"TRV\": {\"features\": {\"market_data\": {\"ticker\": \"TRV\", \"open\": 256.12, \"close_7d\": [248.1, 245.17, 245.13, 250.84, 249.66, 252.48, 255.86]}, \"news_events\": {\"top_k_events\": [\"IBM, Parker-Hannifin Among 10 Companies To Announce Dividend Increases In Second Half Of April - Discover upcoming dividend increases from companies like Procter & Gamble, Johnson & Johnson, Ameriprise Financial, and Parker-Hannifin.\", \"Travelers Companies (NYSE:TRV) Is Increasing Its Dividend To $1.10 - The Travelers Companies, Inc.'s ( NYSE:TRV ) dividend will be increasing from last year's payment of the same period to...\", \"Dividend Champion, Contender, And Challenger Highlights: Week Of April 20\"]}, \"position_state\": {\"current_position_value\": 5191.55, \"holding_days\": 35, \"shares\": 20.27}}}, \"CRM\": {\"features\": {\"market_data\": {\"ticker\": \"CRM\", \"open\": 240.43, \"close_7d\": [265.17, 255.12, 255.0, 254.55, 254.93, 249.84, 247.26]}, \"news_events\": {\"top_k_events\": [\"Salesforce, Inc. (CRM) Pushes AI Agentforce Despite Analyst Downgrades - We recently published a list of Top 10 AI Stocks in the Spotlight This Week. In this article, we are going to take a look at where Salesforce Inc (NYSE:CRM) stands against other top 10 AI stocks in the spotlight this week. According to investment firm Morgan Stanley, electricity demand is going to prove to […]\", \"Insiders At Salesforce Sold US$13m In Stock, Alluding To Potential Weakness - Over the past year, many Salesforce, Inc. ( NYSE:CRM ) insiders sold a significant stake in the company which may have...\", \"Is Salesforce, Inc. (CRM) One of the Best Blue Chip Stocks to Buy According to Billionaires? - We recently published a list of 15 Best Blue Chip Stocks to Buy According to Billionaires. In this article, we are going to take a look at where Salesforce, Inc. (NYSE:CRM) stands against other best blue chip stocks to buy according to billionaires. Is A Potential Trade War on the Horizon? The US stock market […]\", \"4 Top Tech Stocks to Buy Right Now - Amidst the market volatility due to tariffs and trade tensions, many top tech companies are now selling at much more attractive valuations than just a few months ago.  Pinterest (NYSE: PINS) operates an online vision board that has more than 550 million monthly active users (MAU) across the globe.  Better monetizing its user base is a huge opportunity for Pinterest, especially in the markets outside the U.S. and Europe where more than half its user base resides.\", \"Salesforce's Bet On Agentic AI Is Just Getting Started\"]}, \"position_state\": {\"current_position_value\": 1909.01, \"holding_days\": 35, \"shares\": 7.94}}}, \"JPM\": {\"features\": {\"market_data\": {\"ticker\": \"JPM\", \"open\": 230.63, \"close_7d\": [234.34, 227.11, 236.2, 234.72, 233.13, 229.61, 231.96]}, \"news_events\": {\"top_k_events\": [\"Fidelity, Goldman Find Tariff Haven in Asian Consumer Stocks - (Bloomberg) -- The global trade war is providing a boon for Asian consumer stocks, as investors take shelter in companies that cater to local buyers’ essential needs. Most Read from BloombergDOGE Visits National Gallery of Art to Discuss Museum’s Legal StatusTrump Administration Takes Over New York Penn Station RevampDOGE Places Entire Staff of Federal Homelessness Agency on LeaveWhy the Best Bike Lanes Always Get BlamedNashville’s $3 Billion Transit Plan Brings a Call for Zoning ReformStrategis\", \"JPMorgan Chase & Co. (JPM): Among Value Stocks in Ken Fisher’s Portfolio - We recently published a list of 10 Value Stocks in Ken Fisher’s Portfolio. In this article, we are going to take a look at where JPMorgan Chase & Co. (NYSE:JPM) stands against other value stocks in Ken Fisher’s portfolio. Trump’s “stupid” tariffs will fail; that’s the sentiment echoed by billionaire investor Ken Fisher as their […]\", \"Oil Traders Lurch From Praying for Volatility to Drowning in It - (Bloomberg) -- Until recently, oil traders complained that it was almost impossible to wring profits out of a listless and rangebound crude market. After the events of the past two-and-a-half weeks, this may have been a case of “careful what you wish for.”Most Read from BloombergDOGE Visits National Gallery of Art to Discuss Museum’s Legal StatusTrump Administration Takes Over New York Penn Station RevampDOGE Places Entire Staff of Federal Homelessness Agency on LeaveTrump Signs Executive Orders\"]}, \"position_state\": {\"current_position_value\": 6494.54, \"holding_days\": 35, \"shares\": 28.16}}}, \"IBM\": {\"features\": {\"market_data\": {\"ticker\": \"IBM\", \"open\": 238.06, \"close_7d\": [235.31, 229.55, 235.48, 239.06, 240.7, 238.57, 238.81]}, \"news_events\": {\"top_k_events\": [\"IBM, Parker-Hannifin Among 10 Companies To Announce Dividend Increases In Second Half Of April - Discover upcoming dividend increases from companies like Procter & Gamble, Johnson & Johnson, Ameriprise Financial, and Parker-Hannifin.\", \"Google, Tesla, and IBM earnings lead a make-or-break week for stocks - Shaken by geopolitical shocks, the S&P 500 was flat last week and the Nasdaq nosed just into the red — but the Dow Jones Industrial Average finished significantly lower, weighed down by a double blow from UnitedHealth (UNH) and Nvidia (NVDA).\", \"Wall Street Week Ahead\", \"IBM: A Defensive Hold\", \"Tesla, Alphabet To Report Earnings As Investors Watch Out For Consumer Confidence, Jobless Claims\"]}, \"position_state\": {\"current_position_value\": 1999.75, \"holding_days\": 35, \"shares\": 8.4}}}, \"HON\": {\"features\": {\"market_data\": {\"ticker\": \"HON\", \"open\": 194.98, \"close_7d\": [199.1, 193.39, 198.55, 200.25, 198.81, 193.28, 196.6]}, \"news_events\": {\"top_k_events\": [\"ABB: Unlocking Value By Mirroring GE's Spin-Off Success\"]}, \"position_state\": {\"current_position_value\": 2961.75, \"holding_days\": 35, \"shares\": 15.19}}}, \"BA\": {\"features\": {\"market_data\": {\"ticker\": \"BA\", \"open\": 160.0, \"close_7d\": [160.82, 155.52, 156.84, 159.28, 155.52, 156.47, 161.9]}, \"news_events\": {\"top_k_events\": [\"Boeing jet returns to US from China, a victim of Trump's tariff war - A Boeing jet intended for use by a Chinese airline landed back at the planemaker's U.S. production hub on Sunday, a victim of the tit-for-tat bilateral tariffs launched by President Donald Trump in...\", \"Boeing Investors: Here's What the Latest Big News From Delta Air Lines Means for You - Delta Air Lines (NYSE: DAL) was the first major company to report results since the tariff war kicked off in early April.  What its management said had significant implications for the aerospace sector, particularly for Boeing (NYSE: BA).  Here's what happened and why it matters so much for Boeing investors.\", \"Tesla, Alphabet To Report Earnings As Investors Watch Out For Consumer Confidence, Jobless Claims\", \"Tesla, Google To Report Earnings As Investors Watch Out For Consumer Confidence, Jobless Claims\", \"Tesla, Amazon To Report Earnings As Investors Watch Out For Consumer Confidence, Jobless Claims\"]}, \"position_state\": {\"current_position_value\": 0.0, \"holding_days\": 31, \"shares\": 0.0}}}, \"AMZN\": {\"features\": {\"market_data\": {\"ticker\": \"AMZN\", \"open\": 169.6, \"close_7d\": [191.1, 181.22, 184.87, 182.12, 179.59, 174.33, 172.61]}, \"news_events\": {\"top_k_events\": [\"Amazon makes urgent move to avoid US-China trade war impact - The online retail giant is raising eyebrows with its latest move.\", \"2 Top Buffett Stocks to Buy and Hold for the Long Haul - Few investors manage to become a household name, but Warren Buffett is one of them.  Tons of investors look to Berkshire Hathaway's portfolio and investing moves to get an idea of moves they should make.  If you're seeking out a couple of Buffett stocks to add to your portfolio, look no further than the following two.\", \"Why Amazon.com (AMZN) Is the Best Blue Chip Stock to Buy According to Billionaires - We recently published a list of 15 Best Blue Chip Stocks to Buy According to Billionaires. In this article, we are going to take a look at where Amazon.com, Inc. (NASDAQ:AMZN) stands against other best blue chip stocks to buy according to billionaires. Is A Potential Trade War on the Horizon? The US stock market […]\", \"Prediction: 1 Stock That Will Be Worth More Than Nvidia 5 Years From Now - Nvidia (NASDAQ: NVDA) has been one of the hottest stocks on the market in the past five years, delivering remarkable gains of 1,300% to investors during this period and significantly outpacing the tech-laden Nasdaq Composite's returns of about 100%.  Nvidia's market capitalization of $2.5 trillion makes it the third-largest company globally.  The good part is that Nvidia could deliver more gains in the future thanks to a sizable addressable market that could allow it to sustain healthy revenue and earnings growth for years to come.\", \"GAM: Tech Exposure Could Mean Short-Term Pain\"]}, \"position_state\": {\"current_position_value\": 1868.99, \"holding_days\": 35, \"shares\": 11.02}}}, \"AAPL\": {\"features\": {\"market_data\": {\"ticker\": \"AAPL\", \"open\": 193.26, \"close_7d\": [198.85, 190.42, 198.15, 202.52, 202.14, 194.27, 196.98]}, \"news_events\": {\"top_k_events\": [\"Street Calls of the Week - Investing.com -- Here is your Pro Recap of the top takeaways from Wall Street analysts for the past week.\", \"2 Semiconductor Stocks That Could Help Make You a Fortune - Trade tensions have pushed some promising chip stocks to bargain prices. These two chipmakers could deliver impressive returns for patient investors.\", \"Invest In 6 Funds For A Potential $5,000 Monthly Income\", \"Mark Zuckerberg's Facebook, Instagram block new Apple product - The social media leader is sending a strong message to the iPhone maker.\", \"GAM: Tech Exposure Could Mean Short-Term Pain\"]}, \"position_state\": {\"current_position_value\": 2435.14, \"holding_days\": 35, \"shares\": 12.6}}}, \"PG\": {\"features\": {\"market_data\": {\"ticker\": \"PG\", \"open\": 169.89, \"close_7d\": [162.32, 163.56, 166.91, 169.13, 168.47, 166.39, 170.63]}, \"news_events\": {\"top_k_events\": [\"IBM, Parker-Hannifin Among 10 Companies To Announce Dividend Increases In Second Half Of April - Discover upcoming dividend increases from companies like Procter & Gamble, Johnson & Johnson, Ameriprise Financial, and Parker-Hannifin.\", \"Wall Street Week Ahead\", \"Tesla, Alphabet To Report Earnings As Investors Watch Out For Consumer Confidence, Jobless Claims\", \"Tesla, Google To Report Earnings As Investors Watch Out For Consumer Confidence, Jobless Claims\", \"Tesla, Amazon To Report Earnings As Investors Watch Out For Consumer Confidence, Jobless Claims\"]}, \"position_state\": {\"current_position_value\": 6280.83, \"holding_days\": 35, \"shares\": 36.97}}}, \"JNJ\": {\"features\": {\"market_data\": {\"ticker\": \"JNJ\", \"open\": 157.96, \"close_7d\": [150.97, 148.69, 151.73, 154.36, 153.62, 153.91, 157.47]}, \"news_events\": {\"top_k_events\": [\"IBM, Parker-Hannifin Among 10 Companies To Announce Dividend Increases In Second Half Of April - Discover upcoming dividend increases from companies like Procter & Gamble, Johnson & Johnson, Ameriprise Financial, and Parker-Hannifin.\", \"Is Johnson & Johnson (JNJ) the Best Low Volatility Stock to Buy Now? - We recently published a list of 10 Best Low Volatility Stocks to Buy Now. In this article, we are going to take a look at where Johnson & Johnson (NYSE:JNJ) stands against other best low volatility stocks to buy now. The US stock market experienced a turbulent first quarter of 2025, marked by increased volatility […]\", \"2 Recession-Proof Stocks to Buy With a Better Credit Rating Than the U.S. Government - In 2011, following the difficulty caused by the Great Recession, S&P Global Ratings (formerly Standard & Poor's) downgraded the long-term credit outlook of the United States from its highest designation of AAA to AA+, citing budgetary issues.  High credit ratings are not just handed out.  In fact, only two U.S.-based companies maintain the coveted AAA rating from S&P.  They may be a good place for investors to park cash as President Donald Trump attempts to shake up the global trade order with sweeping tariffs -- a situation that could turn into a long-lasting trade war if negotiations are not soon reached.\", \"From $50 A Month To $1M Portfolio — Investor Shares Top 10 Holdings, Says 'Finally Reached $1M!' Thanks To Relentless Discipline - Building wealth through dividends isn’t an overnight success, but rather work that requires relentless discipline, patience, consistency, and the power of compounding. While many chase quick gains, the real magic happens when investors commit to a long-term strategy, reinvesting dividends and steadily growing their portfolios over decades. One investor’s recent milestone proves just that: a $1 million portfolio generating $4,000 a month in passive income, all starting from humble beginnings of j\", \"Johnson & Johnson (JNJ): Among Value Stocks in Ken Fisher’s Portfolio - We recently published a list of 10 Value Stocks in Ken Fisher’s Portfolio. In this article, we are going to take a look at where Johnson & Johnson (NYSE:JNJ) stands against other value stocks in Ken Fisher’s portfolio. Trump’s “stupid” tariffs will fail; that’s the sentiment echoed by billionaire investor Ken Fisher as their impact […]\"]}, \"position_state\": {\"current_position_value\": 5765.54, \"holding_days\": 35, \"shares\": 36.5}}}}, \"history\": {\"GS\": [{\"date\": \"2025-04-17\", \"action\": \"increase\", \"cash_change\": 987.38, \"target_cash_amount\": 4500.0, \"shares\": 8.94, \"confidence\": 0.85}, {\"date\": \"2025-04-16\", \"action\": \"increase\", \"cash_change\": 1006.45, \"target_cash_amount\": 3500.0, \"shares\": 6.98, \"confidence\": 0.85}, {\"date\": \"2025-04-15\", \"action\": \"hold\", \"cash_change\": 0.0, \"target_cash_amount\": 2521.83, \"shares\": 4.97, \"confidence\": 0.65}, {\"date\": \"2025-04-14\", \"action\": \"hold\", \"cash_change\": 0.0, \"target_cash_amount\": 2534.7, \"shares\": 4.97, \"confidence\": 0.65}, {\"date\": \"2025-04-11\", \"action\": \"hold\", \"cash_change\": 0.0, \"target_cash_amount\": 2420.39, \"shares\": 4.97, \"confidence\": 0.65}, {\"date\": \"2025-04-10\", \"action\": \"decrease\", \"cash_change\": -589.03, \"target_cash_amount\": 2500.0, \"shares\": 4.97, \"confidence\": 0.8}, {\"date\": \"2025-04-09\", \"action\": \"hold\", \"cash_change\": 0.0, \"target_cash_amount\": 2771.35, \"shares\": 6.14, \"confidence\": 0.65}], \"MSFT\": [{\"date\": \"2025-04-17\", \"action\": \"hold\", \"cash_change\": 0.0, \"target_cash_amount\": 6252.75, \"shares\": 16.73, \"confidence\": 0.7}, {\"date\": \"2025-04-16\", \"action\": \"hold\", \"cash_change\": 0.0, \"target_cash_amount\": 6368.61, \"shares\": 16.73, \"confidence\": 0.7}, {\"date\": \"2025-04-15\", \"action\": \"increase\", \"cash_change\": 571.41, \"target_cash_amount\": 6500.0, \"shares\": 16.73, \"confidence\": 0.8}, {\"date\": \"2025-04-14\", \"action\": \"increase\", \"cash_change\": 553.9, \"target_cash_amount\": 6000.0, \"shares\": 15.26, \"confidence\": 0.75}, {\"date\": \"2025-04-11\", \"action\": \"decrease\", \"cash_change\": -1000.0, \"target_cash_amount\": 5272.86, \"shares\": 13.85, \"confidence\": 0.75}, {\"date\": \"2025-04-10\", \"action\": \"hold\", \"cash_change\": 0.0, \"target_cash_amount\": 6296.35, \"shares\": 16.48, \"confidence\": 0.7}, {\"date\": \"2025-04-09\", \"action\": \"hold\", \"cash_change\": 0.0, \"target_cash_amount\": 5826.26, \"shares\": 16.48, \"confidence\": 0.7}], \"HD\": [{\"date\": \"2025-04-17\", \"action\": \"hold\", \"cash_change\": 0.0, \"target_cash_amount\": 4475.38, \"shares\": 12.84, \"confidence\": 0.7}, {\"date\": \"2025-04-16\", \"action\": \"hold\", \"cash_change\": 0.0, \"target_cash_amount\": 4517.63, \"shares\": 12.84, \"confidence\": 0.7}, {\"date\": \"2025-04-15\", \"action\": \"hold\", \"cash_change\": 0.0, \"target_cash_amount\": 4578.23, \"shares\": 12.84, \"confidence\": 0.7}, {\"date\": \"2025-04-14\", \"action\": \"hold\", \"cash_change\": 0.0, \"target_cash_amount\": 4594.15, \"shares\": 12.84, \"confidence\": 0.7}, {\"date\": \"2025-04-11\", \"action\": \"hold\", \"cash_change\": 0.0, \"target_cash_amount\": 4497.98, \"shares\": 12.84, \"confidence\": 0.7}, {\"date\": \"2025-04-10\", \"action\": \"hold\", \"cash_change\": 0.0, \"target_cash_amount\": 4530.59, \"shares\": 12.84, \"confidence\": 0.65}, {\"date\": \"2025-04-09\", \"action\": \"hold\", \"cash_change\": 0.0, \"target_cash_amount\": 4219.22, \"shares\": 12.84, \"confidence\": 0.65}], \"V\": [{\"date\": \"2025-04-17\", \"action\": \"hold\", \"cash_change\": 0.0, \"target_cash_amount\": 4012.57, \"shares\": 12.12, \"confidence\": 0.7}, {\"date\": \"2025-04-16\", \"action\": \"hold\", \"cash_change\": 0.0, \"target_cash_amount\": 4060.2, \"shares\": 12.12, \"confidence\": 0.7}, {\"date\": \"2025-04-15\", \"action\": \"hold\", \"cash_change\": 0.0, \"target_cash_amount\": 4081.05, \"shares\": 12.12, \"confidence\": 0.7}, {\"date\": \"2025-04-14\", \"action\": \"hold\", \"cash_change\": 0.0, \"target_cash_amount\": 4077.29, \"shares\": 12.12, \"confidence\": 0.7}, {\"date\": \"2025-04-11\", \"action\": \"hold\", \"cash_change\": 0.0, \"target_cash_amount\": 3932.09, \"shares\": 12.12, \"confidence\": 0.7}, {\"date\": \"2025-04-10\", \"action\": \"hold\", \"cash_change\": 0.0, \"target_cash_amount\": 3975.6, \"shares\": 12.12, \"confidence\": 0.7}, {\"date\": \"2025-04-09\", \"action\": \"hold\", \"cash_change\": 0.0, \"target_cash_amount\": 3704.3, \"shares\": 12.12, \"confidence\": 0.7}], \"SHW\": [{\"date\": \"2025-04-17\", \"action\": \"hold\", \"cash_change\": 0.0, \"target_cash_amount\": 2505.62, \"shares\": 7.41, \"confidence\": 0.65}, {\"date\": \"2025-04-16\", \"action\": \"hold\", \"cash_change\": 0.0, \"target_cash_amount\": 2479.09, \"shares\": 7.41, \"confidence\": 0.65}, {\"date\": \"2025-04-15\", \"action\": \"hold\", \"cash_change\": 0.0, \"target_cash_amount\": 2514.21, \"shares\": 7.41, \"confidence\": 0.6}, {\"date\": \"2025-04-14\", \"action\": \"hold\", \"cash_change\": 0.0, \"target_cash_amount\": 2512.14, \"shares\": 7.41, \"confidence\": 0.6}, {\"date\": \"2025-04-11\", \"action\": \"increase\", \"cash_change\": 500.0, \"target_cash_amount\": 2374.46, \"shares\": 7.41, \"confidence\": 0.8}, {\"date\": \"2025-04-10\", \"action\": \"hold\", \"cash_change\": 0.0, \"target_cash_amount\": 1947.76, \"shares\": 5.85, \"confidence\": 0.6}, {\"date\": \"2025-04-09\", \"action\": \"hold\", \"cash_change\": 0.0, \"target_cash_amount\": 1826.55, \"shares\": 5.85, \"confidence\": 0.6}], \"CAT\": [{\"date\": \"2025-04-17\", \"action\": \"hold\", \"cash_change\": 0.0, \"target_cash_amount\": 2994.74, \"shares\": 10.25, \"confidence\": 0.75}, {\"date\": \"2025-04-16\", \"action\": \"increase\", \"cash_change\": 535.38, \"target_cash_amount\": 3000.0, \"shares\": 10.25, \"confidence\": 0.8}, {\"date\": \"2025-04-15\", \"action\": \"increase\", \"cash_change\": 499.37, \"target_cash_amount\": 2500.0, \"shares\": 8.42, \"confidence\": 0.75}, {\"date\": \"2025-04-14\", \"action\": \"hold\", \"cash_change\": 0.0, \"target_cash_amount\": 2013.04, \"shares\": 6.74, \"confidence\": 0.7}, {\"date\": \"2025-04-11\", \"action\": \"hold\", \"cash_change\": 0.0, \"target_cash_amount\": 1947.52, \"shares\": 6.74, \"confidence\": 0.7}, {\"date\": \"2025-04-10\", \"action\": \"decrease\", \"cash_change\": -738.36, \"target_cash_amount\": 2000.0, \"shares\": 6.74, \"confidence\": 0.85}, {\"date\": \"2025-04-09\", \"action\": \"decrease\", \"cash_change\": -768.07, \"target_cash_amount\": 2500.0, \"shares\": 9.23, \"confidence\": 0.8}], \"MCD\": [{\"date\": \"2025-04-17\", \"action\": \"hold\", \"cash_change\": 0.0, \"target_cash_amount\": 5599.97, \"shares\": 18.11, \"confidence\": 0.75}, {\"date\": \"2025-04-16\", \"action\": \"hold\", \"cash_change\": 0.0, \"target_cash_amount\": 5678.75, \"shares\": 18.11, \"confidence\": 0.75}, {\"date\": \"2025-04-15\", \"action\": \"hold\", \"cash_change\": 0.0, \"target_cash_amount\": 5725.11, \"shares\": 18.11, \"confidence\": 0.75}, {\"date\": \"2025-04-14\", \"action\": \"hold\", \"cash_change\": 0.0, \"target_cash_amount\": 5658.11, \"shares\": 18.11, \"confidence\": 0.75}, {\"date\": \"2025-04-11\", \"action\": \"hold\", \"cash_change\": 0.0, \"target_cash_amount\": 5550.17, \"shares\": 18.11, \"confidence\": 0.75}, {\"date\": \"2025-04-10\", \"action\": \"hold\", \"cash_change\": 0.0, \"target_cash_amount\": 5457.27, \"shares\": 18.11, \"confidence\": 0.7}, {\"date\": \"2025-04-09\", \"action\": \"hold\", \"cash_change\": 0.0, \"target_cash_amount\": 5386.1, \"shares\": 18.11, \"confidence\": 0.7}], \"UNH\": [{\"date\": \"2025-04-17\", \"action\": \"hold\", \"cash_change\": 0.0, \"target_cash_amount\": 4477.32, \"shares\": 9.29, \"confidence\": 0.8}, {\"date\": \"2025-04-16\", \"action\": \"hold\", \"cash_change\": 0.0, \"target_cash_amount\": 5437.62, \"shares\": 9.29, \"confidence\": 0.75}, {\"date\": \"2025-04-15\", \"action\": \"increase\", \"cash_change\": 525.18, \"target_cash_amount\": 5500.0, \"shares\": 9.29, \"confidence\": 0.85}, {\"date\": \"2025-04-14\", \"action\": \"increase\", \"cash_change\": 906.4, \"target_cash_amount\": 5000.0, \"shares\": 8.4, \"confidence\": 0.8}, {\"date\": \"2025-04-11\", \"action\": \"increase\", \"cash_change\": 500.0, \"target_cash_amount\": 4051.19, \"shares\": 6.88, \"confidence\": 0.8}, {\"date\": \"2025-04-10\", \"action\": \"increase\", \"cash_change\": 912.15, \"target_cash_amount\": 3500.0, \"shares\": 6.03, \"confidence\": 0.8}, {\"date\": \"2025-04-09\", \"action\": \"increase\", \"cash_change\": 371.47, \"target_cash_amount\": 2500.0, \"shares\": 4.46, \"confidence\": 0.75}], \"AXP\": [{\"date\": \"2025-04-17\", \"action\": \"hold\", \"cash_change\": 0.0, \"target_cash_amount\": 3470.47, \"shares\": 13.72, \"confidence\": 0.75}, {\"date\": \"2025-04-16\", \"action\": \"increase\", \"cash_change\": 387.05, \"target_cash_amount\": 3500.0, \"shares\": 13.72, \"confidence\": 0.8}, {\"date\": \"2025-04-15\", \"action\": \"hold\", \"cash_change\": 0.0, \"target_cash_amount\": 3123.2, \"shares\": 12.2, \"confidence\": 0.65}, {\"date\": \"2025-04-14\", \"action\": \"hold\", \"cash_change\": 0.0, \"target_cash_amount\": 3129.54, \"shares\": 12.2, \"confidence\": 0.65}, {\"date\": \"2025-04-11\", \"action\": \"hold\", \"cash_change\": 0.0, \"target_cash_amount\": 3012.06, \"shares\": 12.2, \"confidence\": 0.65}, {\"date\": \"2025-04-10\", \"action\": \"hold\", \"cash_change\": 0.0, \"target_cash_amount\": 3111.18, \"shares\": 12.2, \"confidence\": 0.65}, {\"date\": \"2025-04-09\", \"action\": \"hold\", \"cash_change\": 0.0, \"target_cash_amount\": 2768.91, \"shares\": 12.2, \"confidence\": 0.65}], \"AMGN\": [{\"date\": \"2025-04-17\", \"action\": \"hold\", \"cash_change\": 0.0, \"target_cash_amount\": 4446.49, \"shares\": 16.05, \"confidence\": 0.7}, {\"date\": \"2025-04-16\", \"action\": \"hold\", \"cash_change\": 0.0, \"target_cash_amount\": 4730.58, \"shares\": 16.05, \"confidence\": 0.7}, {\"date\": \"2025-04-15\", \"action\": \"hold\", \"cash_change\": 0.0, \"target_cash_amount\": 4723.6, \"shares\": 16.05, \"confidence\": 0.65}, {\"date\": \"2025-04-14\", \"action\": \"hold\", \"cash_change\": 0.0, \"target_cash_amount\": 4602.66, \"shares\": 16.05, \"confidence\": 0.65}, {\"date\": \"2025-04-11\", \"action\": \"decrease\", \"cash_change\": -999.99, \"target_cash_amount\": 4534.18, \"shares\": 16.05, \"confidence\": 0.75}, {\"date\": \"2025-04-10\", \"action\": \"hold\", \"cash_change\": 0.0, \"target_cash_amount\": 5641.53, \"shares\": 19.59, \"confidence\": 0.65}, {\"date\": \"2025-04-09\", \"action\": \"hold\", \"cash_change\": 0.0, \"target_cash_amount\": 5267.95, \"shares\": 19.59, \"confidence\": 0.7}], \"TRV\": [{\"date\": \"2025-04-17\", \"action\": \"hold\", \"cash_change\": 0.0, \"target_cash_amount\": 5130.54, \"shares\": 20.27, \"confidence\": 0.7}, {\"date\": \"2025-04-16\", \"action\": \"hold\", \"cash_change\": 0.0, \"target_cash_amount\": 5184.86, \"shares\": 20.27, \"confidence\": 0.7}, {\"date\": \"2025-04-15\", \"action\": \"hold\", \"cash_change\": 0.0, \"target_cash_amount\": 5066.28, \"shares\": 20.27, \"confidence\": 0.7}, {\"date\": \"2025-04-14\", \"action\": \"hold\", \"cash_change\": 0.0, \"target_cash_amount\": 5037.7, \"shares\": 20.27, \"confidence\": 0.7}, {\"date\": \"2025-04-11\", \"action\": \"hold\", \"cash_change\": 0.0, \"target_cash_amount\": 4969.6, \"shares\": 20.27, \"confidence\": 0.7}, {\"date\": \"2025-04-10\", \"action\": \"increase\", \"cash_change\": 846.41, \"target_cash_amount\": 5000.0, \"shares\": 20.27, \"confidence\": 0.75}, {\"date\": \"2025-04-09\", \"action\": \"hold\", \"cash_change\": 0.0, \"target_cash_amount\": 3894.08, \"shares\": 16.84, \"confidence\": 0.65}], \"CRM\": [{\"date\": \"2025-04-17\", \"action\": \"hold\", \"cash_change\": 0.0, \"target_cash_amount\": 1983.17, \"shares\": 7.94, \"confidence\": 0.6}, {\"date\": \"2025-04-16\", \"action\": \"decrease\", \"cash_change\": -927.43, \"target_cash_amount\": 2000.0, \"shares\": 7.94, \"confidence\": 0.75}, {\"date\": \"2025-04-15\", \"action\": \"hold\", \"cash_change\": 0.0, \"target_cash_amount\": 2955.78, \"shares\": 11.62, \"confidence\": 0.6}, {\"date\": \"2025-04-14\", \"action\": \"hold\", \"cash_change\": 0.0, \"target_cash_amount\": 3021.2, \"shares\": 11.62, \"confidence\": 0.6}, {\"date\": \"2025-04-11\", \"action\": \"hold\", \"cash_change\": 0.0, \"target_cash_amount\": 2954.62, \"shares\": 11.62, \"confidence\": 0.65}, {\"date\": \"2025-04-10\", \"action\": \"hold\", \"cash_change\": 0.0, \"target_cash_amount\": 3021.2, \"shares\": 11.62, \"confidence\": 0.6}, {\"date\": \"2025-04-09\", \"action\": \"increase\", \"cash_change\": 369.32, \"target_cash_amount\": 2800.0, \"shares\": 11.62, \"confidence\": 0.75}], \"JPM\": [{\"date\": \"2025-04-17\", \"action\": \"increase\", \"cash_change\": 1122.36, \"target_cash_amount\": 6500.0, \"shares\": 28.16, \"confidence\": 0.85}, {\"date\": \"2025-04-16\", \"action\": \"hold\", \"cash_change\": 0.0, \"target_cash_amount\": 5405.6, \"shares\": 23.3, \"confidence\": 0.75}, {\"date\": \"2025-04-15\", \"action\": \"increase\", \"cash_change\": 520.65, \"target_cash_amount\": 5500.0, \"shares\": 23.3, \"confidence\": 0.85}, {\"date\": \"2025-04-14\", \"action\": \"increase\", \"cash_change\": 755.91, \"target_cash_amount\": 5000.0, \"shares\": 21.09, \"confidence\": 0.85}, {\"date\": \"2025-04-11\", \"action\": \"hold\", \"cash_change\": 0.0, \"target_cash_amount\": 4050.95, \"shares\": 17.9, \"confidence\": 0.7}, {\"date\": \"2025-04-10\", \"action\": \"hold\", \"cash_change\": 0.0, \"target_cash_amount\": 4117.0, \"shares\": 17.9, \"confidence\": 0.65}, {\"date\": \"2025-04-09\", \"action\": \"hold\", \"cash_change\": 0.0, \"target_cash_amount\": 3803.75, \"shares\": 17.9, \"confidence\": 0.7}], \"IBM\": [{\"date\": \"2025-04-17\", \"action\": \"hold\", \"cash_change\": 0.0, \"target_cash_amount\": 2013.31, \"shares\": 8.4, \"confidence\": 0.65}, {\"date\": \"2025-04-16\", \"action\": \"hold\", \"cash_change\": 0.0, \"target_cash_amount\": 2018.35, \"shares\": 8.4, \"confidence\": 0.65}, {\"date\": \"2025-04-15\", \"action\": \"hold\", \"cash_change\": 0.0, \"target_cash_amount\": 2012.22, \"shares\": 8.4, \"confidence\": 0.6}, {\"date\": \"2025-04-14\", \"action\": \"hold\", \"cash_change\": 0.0, \"target_cash_amount\": 2014.07, \"shares\": 8.4, \"confidence\": 0.6}, {\"date\": \"2025-04-11\", \"action\": \"hold\", \"cash_change\": 0.0, \"target_cash_amount\": 1929.65, \"shares\": 8.4, \"confidence\": 0.6}, {\"date\": \"2025-04-10\", \"action\": \"hold\", \"cash_change\": 0.0, \"target_cash_amount\": 1940.4, \"shares\": 8.4, \"confidence\": 0.6}, {\"date\": \"2025-04-09\", \"action\": \"hold\", \"cash_change\": 0.0, \"target_cash_amount\": 1823.81, \"shares\": 8.4, \"confidence\": 0.6}], \"HON\": [{\"date\": \"2025-04-17\", \"action\": \"hold\", \"cash_change\": 0.0, \"target_cash_amount\": 2965.85, \"shares\": 15.19, \"confidence\": 0.7}, {\"date\": \"2025-04-16\", \"action\": \"decrease\", \"cash_change\": -442.42, \"target_cash_amount\": 3000.0, \"shares\": 15.19, \"confidence\": 0.75}, {\"date\": \"2025-04-15\", \"action\": \"decrease\", \"cash_change\": -767.64, \"target_cash_amount\": 3500.0, \"shares\": 17.43, \"confidence\": 0.7}, {\"date\": \"2025-04-14\", \"action\": \"hold\", \"cash_change\": 0.0, \"target_cash_amount\": 4229.18, \"shares\": 21.25, \"confidence\": 0.65}, {\"date\": \"2025-04-11\", \"action\": \"hold\", \"cash_change\": 0.0, \"target_cash_amount\": 4096.57, \"shares\": 21.25, \"confidence\": 0.65}, {\"date\": \"2025-04-10\", \"action\": \"hold\", \"cash_change\": 0.0, \"target_cash_amount\": 4186.04, \"shares\": 21.25, \"confidence\": 0.65}, {\"date\": \"2025-04-09\", \"action\": \"hold\", \"cash_change\": 0.0, \"target_cash_amount\": 3835.62, \"shares\": 21.25, \"confidence\": 0.65}], \"BA\": [{\"date\": \"2025-04-17\", \"action\": \"hold\", \"cash_change\": 0.0, \"target_cash_amount\": 0.0, \"shares\": 0.0, \"confidence\": 0.8}, {\"date\": \"2025-04-16\", \"action\": \"hold\", \"cash_change\": 0.0, \"target_cash_amount\": 0.0, \"shares\": 0.0, \"confidence\": 0.8}, {\"date\": \"2025-04-15\", \"action\": \"close\", \"cash_change\": -1503.06, \"target_cash_amount\": 0.0, \"shares\": 0.0, \"confidence\": 0.8}, {\"date\": \"2025-04-14\", \"action\": \"hold\", \"cash_change\": 0.0, \"target_cash_amount\": 1547.06, \"shares\": 9.68, \"confidence\": 0.6}, {\"date\": \"2025-04-11\", \"action\": \"hold\", \"cash_change\": 0.0, \"target_cash_amount\": 1496.72, \"shares\": 9.68, \"confidence\": 0.6}, {\"date\": \"2025-04-10\", \"action\": \"decrease\", \"cash_change\": -173.78, \"target_cash_amount\": 1500.0, \"shares\": 9.68, \"confidence\": 0.85}, {\"date\": \"2025-04-09\", \"action\": \"decrease\", \"cash_change\": -391.07, \"target_cash_amount\": 1500.0, \"shares\": 10.8, \"confidence\": 0.8}], \"AMZN\": [{\"date\": \"2025-04-17\", \"action\": \"hold\", \"cash_change\": 0.0, \"target_cash_amount\": 1939.52, \"shares\": 11.02, \"confidence\": 0.6}, {\"date\": \"2025-04-16\", \"action\": \"hold\", \"cash_change\": 0.0, \"target_cash_amount\": 1942.72, \"shares\": 11.02, \"confidence\": 0.7}, {\"date\": \"2025-04-15\", \"action\": \"decrease\", \"cash_change\": -935.21, \"target_cash_amount\": 2000.0, \"shares\": 11.02, \"confidence\": 0.75}, {\"date\": \"2025-04-14\", \"action\": \"hold\", \"cash_change\": 0.0, \"target_cash_amount\": 3023.07, \"shares\": 16.18, \"confidence\": 0.7}, {\"date\": \"2025-04-11\", \"action\": \"hold\", \"cash_change\": 0.0, \"target_cash_amount\": 2911.27, \"shares\": 16.18, \"confidence\": 0.7}, {\"date\": \"2025-04-10\", \"action\": \"decrease\", \"cash_change\": -504.82, \"target_cash_amount\": 3000.0, \"shares\": 16.18, \"confidence\": 0.75}, {\"date\": \"2025-04-09\", \"action\": \"hold\", \"cash_change\": 0.0, \"target_cash_amount\": 3252.97, \"shares\": 18.9, \"confidence\": 0.7}], \"AAPL\": [{\"date\": \"2025-04-17\", \"action\": \"hold\", \"cash_change\": 0.0, \"target_cash_amount\": 2484.72, \"shares\": 12.6, \"confidence\": 0.75}, {\"date\": \"2025-04-16\", \"action\": \"increase\", \"cash_change\": 1026.19, \"target_cash_amount\": 2500.0, \"shares\": 12.6, \"confidence\": 0.8}, {\"date\": \"2025-04-15\", \"action\": \"decrease\", \"cash_change\": -885.93, \"target_cash_amount\": 1500.0, \"shares\": 7.43, \"confidence\": 0.75}, {\"date\": \"2025-04-14\", \"action\": \"increase\", \"cash_change\": 656.24, \"target_cash_amount\": 2500.0, \"shares\": 11.82, \"confidence\": 0.8}, {\"date\": \"2025-04-11\", \"action\": \"hold\", \"cash_change\": 0.0, \"target_cash_amount\": 1622.79, \"shares\": 8.72, \"confidence\": 0.65}, {\"date\": \"2025-04-10\", \"action\": \"hold\", \"cash_change\": 0.0, \"target_cash_amount\": 1648.65, \"shares\": 8.72, \"confidence\": 0.7}, {\"date\": \"2025-04-09\", \"action\": \"increase\", \"cash_change\": 394.36, \"target_cash_amount\": 1500.0, \"shares\": 8.72, \"confidence\": 0.8}], \"PG\": [{\"date\": \"2025-04-17\", \"action\": \"hold\", \"cash_change\": 0.0, \"target_cash_amount\": 6193.58, \"shares\": 36.97, \"confidence\": 0.75}, {\"date\": \"2025-04-16\", \"action\": \"hold\", \"cash_change\": 0.0, \"target_cash_amount\": 6258.47, \"shares\": 36.97, \"confidence\": 0.75}, {\"date\": \"2025-04-15\", \"action\": \"hold\", \"cash_change\": 0.0, \"target_cash_amount\": 6253.11, \"shares\": 36.97, \"confidence\": 0.75}, {\"date\": \"2025-04-14\", \"action\": \"hold\", \"cash_change\": 0.0, \"target_cash_amount\": 6175.47, \"shares\": 36.97, \"confidence\": 0.75}, {\"date\": \"2025-04-11\", \"action\": \"hold\", \"cash_change\": 0.0, \"target_cash_amount\": 6039.79, \"shares\": 36.97, \"confidence\": 0.75}, {\"date\": \"2025-04-10\", \"action\": \"hold\", \"cash_change\": 0.0, \"target_cash_amount\": 6022.41, \"shares\": 36.97, \"confidence\": 0.75}, {\"date\": \"2025-04-09\", \"action\": \"hold\", \"cash_change\": 0.0, \"target_cash_amount\": 5817.6, \"shares\": 36.97, \"confidence\": 0.7}], \"JNJ\": [{\"date\": \"2025-04-17\", \"action\": \"hold\", \"cash_change\": 0.0, \"target_cash_amount\": 5626.84, \"shares\": 36.5, \"confidence\": 0.7}, {\"date\": \"2025-04-16\", \"action\": \"hold\", \"cash_change\": 0.0, \"target_cash_amount\": 5671.01, \"shares\": 36.5, \"confidence\": 0.7}, {\"date\": \"2025-04-15\", \"action\": \"hold\", \"cash_change\": 0.0, \"target_cash_amount\": 5683.05, \"shares\": 36.5, \"confidence\": 0.7}, {\"date\": \"2025-04-14\", \"action\": \"hold\", \"cash_change\": 0.0, \"target_cash_amount\": 5532.85, \"shares\": 36.5, \"confidence\": 0.7}, {\"date\": \"2025-04-11\", \"action\": \"hold\", \"cash_change\": 0.0, \"target_cash_amount\": 5450.55, \"shares\": 36.5, \"confidence\": 0.7}, {\"date\": \"2025-04-10\", \"action\": \"hold\", \"cash_change\": 0.0, \"target_cash_amount\": 5488.51, \"shares\": 36.5, \"confidence\": 0.65}, {\"date\": \"2025-04-09\", \"action\": \"hold\", \"cash_change\": 0.0, \"target_cash_amount\": 5190.3, \"shares\": 36.5, \"confidence\": 0.7}]}}", "system_prompt_length": 5337, "user_prompt_length": 40200}, "output": {"parsed_response": {"stocks_need_fundamental": ["GS", "MSFT", "SHW", "MCD", "UNH", "TRV", "CRM", "JPM", "IBM", "AMZN", "AAPL", "PG", "JNJ"], "reasoning": {"GS": "Technical anomaly detected with 5.2% volatility in close_7d pattern; news_events indicate significant tariff and trade war exposure requiring fundamental risk assessment", "MSFT": "News-driven concerns about Azure growth and floor price at 380 require fundamental validation; declining technical trend (-5.8% over 7 days) needs fundamental context", "SHW": "News_events specifically mention valuation concerns as 'overvalued' requiring fundamental assessment; position at key inflection point", "MCD": "News_events identify stock as 'currently too overvalued' requiring fundamental validation; large position (7.3% of portfolio) needs fundamental justification", "UNH": "CRITICAL: Extreme technical anomaly with 22.4% single-day drop from 585.04 to 454.11; news_events describe as 'One Of The Worst Days In UnitedHealth History' requiring immediate fundamental validation", "TRV": "Corporate event in news_events announcing dividend increase to $1.10 requires fundamental validation; positive catalyst needs fundamental context", "CRM": "News-driven concerns about AI Agentforce strategy, analyst downgrades, and insider selling ($13m) require fundamental validation; declining technical trend (-6.7%) needs fundamental context", "JPM": "LARGEST portfolio position (8.4% at $6,495) with trade war exposure in news_events requires fundamental risk validation; concentration risk necessitates fundamental assessment", "IBM": "News_events mention upcoming earnings and dividend increase requiring fundamental preparation; corporate events need fundamental context", "AMZN": "News_events highlight trade war impact concerns requiring fundamental validation; declining technical trend (-9.7%) needs fundamental context", "AAPL": "Corporate conflict event in news_events (Facebook/Instagram blocking Apple product) requires fundamental impact assessment; competitive dynamics need fundamental analysis", "PG": "Large position (8.1% at $6,281) with dividend increase announcement in news_events requires fundamental validation; concentration risk plus corporate event needs fundamental context", "JNJ": "Corporate events in news_events including dividend increase and AAA credit rating mentions require fundamental validation; significant position (7.5% of portfolio) needs fundamental context", "HD": "Technical pattern sufficient: stable close_7d range with minor volatility; no material news catalysts; position size within normal allocation limits", "V": "Technical pattern adequate: stable close_7d pattern with minimal news; position size within normal allocation (5.2% of portfolio)", "CAT": "Technical signals sufficient: moderate volatility within normal range; news_events limited to dividend discussions; position management adequate", "AXP": "Routine technical signals: close_7d pattern shows normal volatility; no material news catalysts; standard position management sufficient", "AMGN": "Technical pattern sufficient: moderate volatility within expected range; limited news_events; position within normal allocation limits", "HON": "Technical analysis adequate: stable close_7d pattern; minimal relevant news; position size appropriate for technical management", "BA": "No current position (closed at $0 value); technical and fundamental analysis not required for inactive position"}}, "raw_response": {"choices": [{"message": {"content": "\n<ANALYSIS>\nLooking at the portfolio and each stock's market data, news events, position state, and historical decisions:\n\n1. **GS (Goldman Sachs)**: \n   - Market data: Close prices [516.87, 489.8, 494.44, 503.98, 507.89, 499.05, 509.49] - shows volatility with a drop from 516.87 to 489.8 (-5.2%), then recovery\n   - News: Multiple articles about tariff impacts and trade war effects, plus mention as value stock\n   - Position: $4,518 position (5.9% of portfolio), held 35 days\n   - Technical anomaly detected with significant volatility\n   - **NEEDS FUNDAMENTAL ANALYSIS**\n\n2. **MSFT (Microsoft)**:\n   - Market data: Close prices [390.49, 381.35, 388.45, 387.81, 385.73, 371.61, 367.78] - declining trend (-5.8% over 7 days)\n   - News: Jim Cramer warnings about Azure, quantum computing mentions, metaverse discussions\n   - Position: $6,070 position (7.9% of portfolio), held 35 days\n   - News-driven concerns about Azure growth require fundamental validation\n   - **NEEDS FUNDAMENTAL ANALYSIS**\n\n3. **HD (Home Depot)**:\n   - Market data: Close prices [355.39, 353.62, 353.86, 357.2, 354.11, 345.99, 355.06] - relatively stable, minor volatility\n   - News: Limited news about retail operations\n   - Position: $4,549 position (5.9% of portfolio), held 35 days\n   - Technical patterns sufficient, no major news catalysts\n   - **NO FUNDAMENTAL ANALYSIS NEEDED**\n\n4. **V (Visa)**:\n   - Market data: Close prices [332.43, 324.61, 333.4, 335.18, 335.81, 331.33, 329.61] - stable pattern\n   - News: Minimal news, general investment articles\n   - Position: $3,987 position (5.2% of portfolio), held 35 days\n   - Stable technicals, no significant news\n   - **NO FUNDAMENTAL ANALYSIS NEEDED**\n\n5. **SHW (Sherwin-Williams)**:\n   - Market data: Close prices [336.25, 329.91, 336.77, 341.02, 336.88, 331.28, 333.38] - relatively stable\n   - News: Mention in market drop article, valuation concerns\n   - Position: $2,459 position (3.2% of portfolio), held 35 days\n   - News suggests valuation concerns requiring fundamental assessment\n   - **NEEDS FUNDAMENTAL ANALYSIS**\n\n6. **CAT (Caterpillar)**:\n   - Market data: Close prices [301.01, 289.16, 293.45, 298.12, 293.43, 290.14, 294.25] - moderate volatility\n   - News: Dividend-focused articles, general market commentary\n   - Position: $2,966 position (3.8% of portfolio), held 35 days\n   - Technical patterns adequate, no material news catalysts\n   - **NO FUNDAMENTAL ANALYSIS NEEDED**\n\n7. **MCD (McDonald's)**:\n   - Market data: Close prices [303.96, 306.78, 309.9, 316.07, 312.48, 309.1, 311.3] - stable upward trend\n   - News: Valuation concerns mentioned as \"overvalued\"\n   - Position: $5,632 position (7.3% of portfolio), held 35 days\n   - News suggests valuation concerns requiring fundamental assessment\n   - **NEEDS FUNDAMENTAL ANALYSIS**\n\n8. **UNH (UnitedHealth)**:\n   - Market data: Close prices [578.5, 594.4, 599.47, 587.06, 583.59, 585.04, 454.11] - MASSIVE drop from 585.04 to 454.11 (-22.4%)\n   - News: \"One Of The Worst Days In The UnitedHealth History\", significant selloff\n   - Position: $4,178 position (5.4% of portfolio), held 35 days\n   - Extreme technical anomaly requiring immediate fundamental validation\n   - **NEEDS FUNDAMENTAL ANALYSIS**\n\n9. **AXP (American Express)**:\n   - Market data: Close prices [262.36, 246.89, 251.13, 255.38, 257.86, 252.92, 251.31] - moderate volatility but stable overall\n   - News: Minimal news, general investment mentions\n   - Position: $3,414 position (4.4% of portfolio), held 35 days\n   - Technical patterns sufficient\n   - **NO FUNDAMENTAL ANALYSIS NEEDED**\n\n10. **AMGN (Amgen)**:\n    - Market data: Close prices [291.09, 281.41, 285.98, 293.92, 295.3, 282.64, 277.29] - moderate volatility\n    - News: Limited news, general stock analysis\n    - Position: $4,451 position (5.8% of portfolio), held 35 days\n    - Technical patterns adequate\n    - **NO FUNDAMENTAL ANALYSIS NEEDED**\n\n11. **TRV (Travelers)**:\n    - Market data: Close prices [248.1, 245.17, 245.13, 250.84, 249.66, 252.48, 255.86] - stable pattern\n    - News: Dividend increase announcements\n    - Position: $5,192 position (6.7% of portfolio), held 35 days\n    - Positive corporate event (dividend increase) requires fundamental validation\n    - **NEEDS FUNDAMENTAL ANALYSIS**\n\n12. **CRM (Salesforce)**:\n    - Market data: Close prices [265.17, 255.12, 255.0, 254.55, 254.93, 249.84, 247.26] - declining trend (-6.7% over 7 days)\n    - News: AI Agentforce concerns, insider selling, analyst downgrades\n    - Position: $1,909 position (2.5% of portfolio), held 35 days\n    - News-driven concerns about AI strategy and insider selling require fundamental validation\n    - **NEEDS FUNDAMENTAL ANALYSIS**\n\n13. **JPM (JPMorgan)**:\n    - Market data: Close prices [234.34, 227.11, 236.2, 234.72, 233.13, 229.61, 231.96] - moderate volatility but stable\n    - News: Similar to GS, trade war and tariff impacts\n    - Position: $6,495 position (8.4% of portfolio), held 35 days - LARGEST position\n    - Large position exposure plus trade war concerns require fundamental validation\n    - **NEEDS FUNDAMENTAL ANALYSIS**\n\n14. **IBM**:\n    - Market data: Close prices [235.31, 229.55, 235.48, 239.06, 240.7, 238.57, 238.81] - relatively stable\n    - News: Dividend increase mention, earnings anticipation\n    - Position: $2,000 position (2.6% of portfolio), held 35 days\n    - Upcoming earnings require fundamental preparation\n    - **NEEDS FUNDAMENTAL ANALYSIS**\n\n15. **HON (Honeywell)**:\n    - Market data: Close prices [199.1, 193.39, 198.55, 200.25, 198.81, 193.28, 196.6] - stable pattern\n    - News: Minimal relevant news\n    - Position: $2,962 position (3.8% of portfolio), held 35 days\n    - Technical patterns sufficient\n    - **NO FUNDAMENTAL ANALYSIS NEEDED**\n\n16. **BA (Boeing)**:\n    - Market data: Close prices [160.82, 155.52, 156.84, 159.28, 155.52, 156.47, 161.9] - moderate volatility\n    - News: Tariff war impacts on China deals, airline implications\n    - Position: $0 position (closed), held 31 days\n    - No position, no analysis needed\n    - **NO FUNDAMENTAL ANALYSIS NEEDED**\n\n17. **AMZN (Amazon)**:\n    - Market data: Close prices [191.1, 181.22, 184.87, 182.12, 179.59, 174.33, 172.61] - declining trend (-9.7% over 7 days)\n    - News: Trade war impact concerns, general investment mentions\n    - Position: $1,869 position (2.4% of portfolio), held 35 days\n    - News-driven trade war concerns require fundamental validation\n    - **NEEDS FUNDAMENTAL ANALYSIS**\n\n18. **AAPL (Apple)**:\n    - Market data: Close prices [198.85, 190.42, 198.15, 202.52, 202.14, 194.27, 196.98] - volatility but range-bound\n    - News: Semiconductor discussions, Facebook/Instagram blocking Apple product\n    - Position: $2,435 position (3.2% of portfolio), held 35 days\n    - Corporate conflict with Meta/Facebook requires fundamental understanding\n    - **NEEDS FUNDAMENTAL ANALYSIS**\n\n19. **PG (Procter & Gamble)**:\n    - Market data: Close prices [162.32, 163.56, 166.91, 169.13, 168.47, 166.39, 170.63] - stable upward trend\n    - News: Dividend increase mention\n    - Position: $6,281 position (8.1% of portfolio), held 35 days - 2nd largest position\n    - Large position plus dividend increase requires fundamental validation\n    - **NEEDS FUNDAMENTAL ANALYSIS**\n\n20. **JNJ (Johnson & Johnson)**:\n    - Market data: Close prices [150.97, 148.69, 151.73, 154.36, 153.62, 153.91, 157.47] - stable upward trend\n    - News: Dividend increase, AAA credit rating mentions\n    - Position: $5,766 position (7.5% of portfolio), held 35 days\n    - Corporate events (dividend, credit rating) require fundamental validation\n    - **NEEDS FUNDAMENTAL ANALYSIS**\n</ANALYSIS>\n\n<FILTER_RESULT>\n{\n  \"stocks_need_fundamental\": [\"GS\", \"MSFT\", \"SHW\", \"MCD\", \"UNH\", \"TRV\", \"CRM\", \"JPM\", \"IBM\", \"AMZN\", \"AAPL\", \"PG\", \"JNJ\"],\n  \"reasoning\": {\n    \"GS\": \"Technical anomaly detected with 5.2% volatility in close_7d pattern; news_events indicate significant tariff and trade war exposure requiring fundamental risk assessment\",\n    \"MSFT\": \"News-driven concerns about Azure growth and floor price at 380 require fundamental validation; declining technical trend (-5.8% over 7 days) needs fundamental context\",\n    \"SHW\": \"News_events specifically mention valuation concerns as 'overvalued' requiring fundamental assessment; position at key inflection point\",\n    \"MCD\": \"News_events identify stock as 'currently too overvalued' requiring fundamental validation; large position (7.3% of portfolio) needs fundamental justification\",\n    \"UNH\": \"CRITICAL: Extreme technical anomaly with 22.4% single-day drop from 585.04 to 454.11; news_events describe as 'One Of The Worst Days In UnitedHealth History' requiring immediate fundamental validation\",\n    \"TRV\": \"Corporate event in news_events announcing dividend increase to $1.10 requires fundamental validation; positive catalyst needs fundamental context\",\n    \"CRM\": \"News-driven concerns about AI Agentforce strategy, analyst downgrades, and insider selling ($13m) require fundamental validation; declining technical trend (-6.7%) needs fundamental context\",\n    \"JPM\": \"LARGEST portfolio position (8.4% at $6,495) with trade war exposure in news_events requires fundamental risk validation; concentration risk necessitates fundamental assessment\",\n    \"IBM\": \"News_events mention upcoming earnings and dividend increase requiring fundamental preparation; corporate events need fundamental context\",\n    \"AMZN\": \"News_events highlight trade war impact concerns requiring fundamental validation; declining technical trend (-9.7%) needs fundamental context\",\n    \"AAPL\": \"Corporate conflict event in news_events (Facebook/Instagram blocking Apple product) requires fundamental impact assessment; competitive dynamics need fundamental analysis\",\n    \"PG\": \"Large position (8.1% at $6,281) with dividend increase announcement in news_events requires fundamental validation; concentration risk plus corporate event needs fundamental context\",\n    \"JNJ\": \"Corporate events in news_events including dividend increase and AAA credit rating mentions require fundamental validation; significant position (7.5% of portfolio) needs fundamental context\",\n    \"HD\": \"Technical pattern sufficient: stable close_7d range with minor volatility; no material news catalysts; position size within normal allocation limits\",\n    \"V\": \"Technical pattern adequate: stable close_7d pattern with minimal news; position size within normal allocation (5.2% of portfolio)\",\n    \"CAT\": \"Technical signals sufficient: moderate volatility within normal range; news_events limited to dividend discussions; position management adequate\",\n    \"AXP\": \"Routine technical signals: close_7d pattern shows normal volatility; no material news catalysts; standard position management sufficient\",\n    \"AMGN\": \"Technical pattern sufficient: moderate volatility within expected range; limited news_events; position within normal allocation limits\",\n    \"HON\": \"Technical analysis adequate: stable close_7d pattern; minimal relevant news; position size appropriate for technical management\",\n    \"BA\": \"No current position (closed at $0 value); technical and fundamental analysis not required for inactive position\"\n  }\n}\n</FILTER_RESULT>"}}], "usage": {"prompt_tokens": 14500, "completion_tokens": 6518, "total_tokens": 21018}}, "parsed_response_length": 3435, "raw_response_length": 11495}}